{
  "$schema": "https://json-schema.org/draft/2020-12/schema",
  "$id": "https://workflow-skill-router.dev/schemas/v2/routing-profile.schema.json",
  "title": "Workflow Skill Router V2 Personal Routing Profile",
  "type": "object",
  "additionalProperties": false,
  "required": [
    "schema_id",
    "schema_version",
    "artifact_kind",
    "profile_id",
    "scope",
    "enabled",
    "rules"
  ],
  "properties": {
    "schema_id": {"const": "workflow-skill-router/routing-profile"},
    "schema_version": {"const": "1.0.0"},
    "artifact_kind": {"const": "routing-profile"},
    "profile_id": {
      "type": "string",
      "pattern": "^(personal|workspace):[a-z0-9][a-z0-9._-]{0,63}$"
    },
    "scope": {"enum": ["personal", "workspace"]},
    "enabled": {"type": "boolean"},
    "rules": {
      "type": "array",
      "minItems": 1,
      "maxItems": 64,
      "items": {"$ref": "#/$defs/rule"}
    }
  },
  "$defs": {
    "identifier": {
      "type": "string",
      "pattern": "^[a-z0-9][a-z0-9._-]{0,63}$"
    },
    "skillId": {
      "type": "string",
      "pattern": "^skill:[A-Za-z0-9][A-Za-z0-9._:/-]{0,127}$"
    },
    "uniqueIdentifiers": {
      "type": "array",
      "maxItems": 32,
      "uniqueItems": true,
      "items": {"$ref": "#/$defs/identifier"}
    },
    "match": {
      "type": "object",
      "additionalProperties": false,
      "required": ["objective_keywords", "domains", "tags", "work_modes"],
      "properties": {
        "objective_keywords": {
          "type": "array",
          "maxItems": 32,
          "uniqueItems": true,
          "items": {"type": "string", "minLength": 1, "maxLength": 128}
        },
        "domains": {"$ref": "#/$defs/uniqueIdentifiers"},
        "tags": {"$ref": "#/$defs/uniqueIdentifiers"},
        "work_modes": {
          "type": "array",
          "maxItems": 3,
          "uniqueItems": true,
          "items": {"enum": ["single", "phased", "managed-goal"]}
        }
      }
    },
    "skillTreePhase": {
      "type": "object",
      "additionalProperties": false,
      "required": [
        "phase_id",
        "primary_skill_id",
        "support_skill_ids",
        "exit_gate"
      ],
      "properties": {
        "phase_id": {"$ref": "#/$defs/identifier"},
        "primary_skill_id": {"$ref": "#/$defs/skillId"},
        "support_skill_ids": {
          "type": "array",
          "maxItems": 3,
          "uniqueItems": true,
          "items": {"$ref": "#/$defs/skillId"}
        },
        "exit_gate": {"$ref": "#/$defs/identifier"}
      }
    },
    "route": {
      "type": "object",
      "additionalProperties": false,
      "required": ["work_mode", "skill_tree"],
      "properties": {
        "work_mode": {"enum": ["single", "phased", "managed-goal"]},
        "skill_tree": {
          "type": "array",
          "minItems": 1,
          "maxItems": 32,
          "items": {"$ref": "#/$defs/skillTreePhase"}
        }
      }
    },
    "rule": {
      "type": "object",
      "additionalProperties": false,
      "required": ["rule_id", "priority", "match", "route"],
      "properties": {
        "rule_id": {"$ref": "#/$defs/identifier"},
        "priority": {"type": "integer", "minimum": -1000, "maximum": 1000},
        "match": {"$ref": "#/$defs/match"},
        "route": {"$ref": "#/$defs/route"}
      }
    }
  }
}
